{"audit_binding":{"audit_id":"native-audit-c752652ee8c277c3c8299d11faf053a0","audit_integrity_sha256":"328368360f2536762a0679e862996b0ae4dc3aa850ae1366fd5f89c68551f3f4"},"created_at":"2030-01-01T00:02:00Z","integrity":{"algorithm":"SHA-256","sha256":"a8d6ccb199c1f42d321b6dbfdb55469f067d964750e0e7a321dd3611bf5cb6ae"},"non_claims":{"evidence_only":true,"external_transaction_claim_unproven":true,"real_host_integration_unproven":true},"operation_results":[{"kind":"translate_dbtext","operation_id":"native-operation-aaaaaaaaaaaaaaaaaaaaaaaa","verified":true}],"output_binding":{"byte_size":129,"dwg_header_signature":"AC1032","file_identity_fingerprint":"5f84f12b50ba4741a54325334fb204e6af77f7c30cf341c76cea2b33bb2fc222","format":"DWG","path_fingerprint":"a0af9f865bf637e6736817f4ce552e4cdf7b8c36ea75bc254c1d1f0af744b5bf","sha256":"37adae9a85f743437b2c311f5b276dc2ad88937600d43a7d34b8227efdc0db26","verified_at":"2030-01-01T00:02:00Z"},"passed":true,"plan_binding":{"plan_id":"native-plan-6ff0e9e890df13e9f4b7421a8c46481d","plan_integrity_sha256":"d39f9050756e77d85c48eb83a1e1020d9d7b5b2460819dc242efb8a45831e94d"},"record_cardinality":"explicit_private","schema_version":"liang-pingfa/native-verification/v1","transition_digest":"b9940d36a68e3443a9a9e76535bd54859e6a06d9884e72d778bae1eac8cde022","verification_id":"native-verification-ffffffffffffffffffffffffffffffff"}
